{"keys":[{"environment":"staging","fingerprint":"SHA256:AAAAAAAAAAAAAAAAAAAAAAAAAAAAAAAAAAAAAAAAAAA","key_id":"deployment-attestation-staging-v1","key_version":1,"not_after":"2027-01-01T00:00:00.000Z","not_before":"2026-01-01T00:00:00.000Z","status":"active"}],"schema_version":1,"signature":"AAAAAAAAAAAAAAAAAAAAAAAAAAAAAAAAAAAAAAAAAAAAAAAAAAAAAAAAAAAAAAAAAAAAAAAAAAAAAAAAAAAAAA","signature_algorithm":"ed25519","signer_key_fingerprint":"SHA256:AAAAAAAAAAAAAAAAAAAAAAAAAAAAAAAAAAAAAAAAAAA","type":"agentpass.deployment-attestation-trust"}
